{
  "schema": "urn:srac:schema:correlation-report:1",
  "reportVersion": "1.0.0",
  "generatedAt": "2026-10-09T12:00:00Z",
  "producer": {"name": "trivy-plugin-srac", "version": "0.2.0"},
  "authorityBoundary": {"mode": "external", "readOnly": true},
  "trivySchemaVersion": 2,
  "sracDocumentId": "urn:example:srac:ambiguous",
  "inputs": [
    {"role": "trivy-report", "name": "trivy.json", "mediaType": "application/json", "sha256": "0000000000000000000000000000000000000000000000000000000000000000"},
    {"role": "srac-document", "name": "srac.json", "mediaType": "application/srac+json", "sha256": "1111111111111111111111111111111111111111111111111111111111111111"}
  ],
  "summary": {"matched": 0, "unmatched": 0, "ambiguous": 1, "invalid": 0, "stale": 0},
  "correlations": [{
    "assertionId": "A-1", "state": "ambiguous",
    "resolvedIdentity": {"purl": "pkg:generic/dup@1.0.0"},
    "correlationRule": {"type": "exact-purl", "sourceField": "component.purl", "targetField": "PkgIdentifier.PURL"},
    "matches": [
      {"purl": "pkg:generic/dup@1.0.0", "name": "dup-a", "version": "1.0.0"},
      {"purl": "pkg:generic/dup@1.0.0", "name": "dup-b", "version": "1.0.0"}
    ]
  }]
}
